{
  "schema_version": "wake.evaluation_ground_truth.v1",
  "fixture_id": "case-005-tailwind-fast-not-improvement",
  "fixture_version": "1.0",
  "applicable_dimensions": [
    "plan_interpretation",
    "segment_reconstruction",
    "deviation_detection",
    "evidence_and_abstention",
    "environmental_interpretation"
  ],
  "expected_session_matches": [],
  "expected_segments": [
    {
      "segment_id": "work-01",
      "kind": "WORK",
      "start_offset_s": 0.0,
      "end_offset_s": 128.062,
      "distance_m": 500.0,
      "average_speed_m_s": 3.904,
      "average_spm": 20.98,
      "compliance": "COMPLIANT"
    },
    {
      "segment_id": "recovery-01",
      "kind": "RECOVERY",
      "start_offset_s": 128.062,
      "end_offset_s": 278.062,
      "distance_m": 247.927,
      "average_speed_m_s": 1.653,
      "average_spm": 15.99,
      "compliance": "COMPLIANT"
    },
    {
      "segment_id": "work-02",
      "kind": "WORK",
      "start_offset_s": 278.062,
      "end_offset_s": 406.021,
      "distance_m": 500.0,
      "average_speed_m_s": 3.907,
      "average_spm": 21.01,
      "compliance": "COMPLIANT"
    },
    {
      "segment_id": "recovery-02",
      "kind": "RECOVERY",
      "start_offset_s": 406.021,
      "end_offset_s": 556.021,
      "distance_m": 247.414,
      "average_speed_m_s": 1.649,
      "average_spm": 16.01,
      "compliance": "COMPLIANT"
    },
    {
      "segment_id": "work-03",
      "kind": "WORK",
      "start_offset_s": 556.021,
      "end_offset_s": 684.065,
      "distance_m": 500.0,
      "average_speed_m_s": 3.905,
      "average_spm": 20.98,
      "compliance": "COMPLIANT"
    },
    {
      "segment_id": "recovery-03",
      "kind": "RECOVERY",
      "start_offset_s": 684.065,
      "end_offset_s": 834.065,
      "distance_m": 247.654,
      "average_speed_m_s": 1.651,
      "average_spm": 16.02,
      "compliance": "COMPLIANT"
    },
    {
      "segment_id": "work-04",
      "kind": "WORK",
      "start_offset_s": 834.065,
      "end_offset_s": 962.01,
      "distance_m": 500.0,
      "average_speed_m_s": 3.908,
      "average_spm": 21.0,
      "compliance": "COMPLIANT"
    }
  ],
  "expected_source_policy": {
    "stroke_rate_spm": "speedcoach-case-005-tailwind-fast-not-improvement",
    "distance_m": "speedcoach-case-005-tailwind-fast-not-improvement",
    "route": "speedcoach-case-005-tailwind-fast-not-improvement",
    "environment": "environment-case-005-tailwind-fast-not-improvement"
  },
  "expected_claims": [
    {
      "claim_id": "observed-work-count",
      "expectation": "Telemetry contains 4 observed work intervals against 4 planned intervals.",
      "evidence_refs": [
        "speedcoach.csv",
        "plan.json"
      ]
    }
  ],
  "required_abstentions": [
    "Do not infer visible technique or crew synchronization from numeric telemetry.",
    "Do not present synthetic people, places, dates, or conditions as real observations.",
    "Do not claim that wind caused the measured speed or proves athlete improvement or regression."
  ],
  "required_questions": [],
  "tolerances": {
    "segment_boundary_s": 10.0,
    "distance_m": 15.0,
    "stroke_rate_spm": 1.0,
    "clock_offset_s": 0.1
  }
}
