{
  "schema_version": "wake.evaluation_ground_truth.v1",
  "fixture_id": "case-010-mobile-spm-zero",
  "fixture_version": "1.0",
  "applicable_dimensions": [
    "plan_interpretation",
    "segment_reconstruction",
    "deviation_detection",
    "evidence_and_abstention",
    "session_association_and_alignment",
    "metric_level_source_trust"
  ],
  "expected_session_matches": [
    {
      "source_ids": [
        "speedcoach-case-010-mobile-spm-zero",
        "mobile-case-010-mobile-spm-zero"
      ],
      "decision": "MATCH",
      "clock_offset_s": 18.0
    }
  ],
  "expected_segments": [
    {
      "segment_id": "work-01",
      "kind": "WORK",
      "start_offset_s": 0.0,
      "end_offset_s": 149.185,
      "distance_m": 500.0,
      "average_speed_m_s": 3.351,
      "average_spm": 21.01,
      "compliance": "COMPLIANT"
    },
    {
      "segment_id": "recovery-01",
      "kind": "RECOVERY",
      "start_offset_s": 149.185,
      "end_offset_s": 299.185,
      "distance_m": 247.927,
      "average_speed_m_s": 1.653,
      "average_spm": 16.0,
      "compliance": "COMPLIANT"
    },
    {
      "segment_id": "work-02",
      "kind": "WORK",
      "start_offset_s": 299.185,
      "end_offset_s": 448.342,
      "distance_m": 500.0,
      "average_speed_m_s": 3.352,
      "average_spm": 21.0,
      "compliance": "COMPLIANT"
    },
    {
      "segment_id": "recovery-02",
      "kind": "RECOVERY",
      "start_offset_s": 448.342,
      "end_offset_s": 598.342,
      "distance_m": 247.551,
      "average_speed_m_s": 1.65,
      "average_spm": 15.99,
      "compliance": "COMPLIANT"
    },
    {
      "segment_id": "work-03",
      "kind": "WORK",
      "start_offset_s": 598.342,
      "end_offset_s": 747.749,
      "distance_m": 500.0,
      "average_speed_m_s": 3.347,
      "average_spm": 20.99,
      "compliance": "COMPLIANT"
    },
    {
      "segment_id": "recovery-03",
      "kind": "RECOVERY",
      "start_offset_s": 747.749,
      "end_offset_s": 897.749,
      "distance_m": 247.448,
      "average_speed_m_s": 1.65,
      "average_spm": 15.99,
      "compliance": "COMPLIANT"
    },
    {
      "segment_id": "work-04",
      "kind": "WORK",
      "start_offset_s": 897.749,
      "end_offset_s": 1046.983,
      "distance_m": 500.0,
      "average_speed_m_s": 3.351,
      "average_spm": 20.98,
      "compliance": "COMPLIANT"
    }
  ],
  "expected_source_policy": {
    "stroke_rate_spm": "speedcoach-case-010-mobile-spm-zero",
    "distance_m": "speedcoach-case-010-mobile-spm-zero",
    "route": "speedcoach-case-010-mobile-spm-zero",
    "mobile_spm": "reject"
  },
  "expected_claims": [
    {
      "claim_id": "observed-work-count",
      "expectation": "Telemetry contains 4 observed work intervals against 4 planned intervals.",
      "evidence_refs": [
        "speedcoach.csv",
        "plan.json"
      ]
    },
    {
      "claim_id": "mobile-spm-unusable",
      "expectation": "Mobile SPM is stuck at zero and cannot support stroke-rate claims.",
      "evidence_refs": [
        "mobile.csv"
      ]
    }
  ],
  "required_abstentions": [
    "Do not infer visible technique or crew synchronization from numeric telemetry.",
    "Do not present synthetic people, places, dates, or conditions as real observations.",
    "Do not use the zero-only mobile SPM channel."
  ],
  "required_questions": [],
  "tolerances": {
    "segment_boundary_s": 10.0,
    "distance_m": 15.0,
    "stroke_rate_spm": 1.0,
    "clock_offset_s": 0.1
  }
}
